57ff8020b3fcec148d8e3eb4.json,57ff8020b3fcec148d8e3eb4,False,"After getting off the train at Meenapur, where did Tara go?",qti,multi-language,files,multi-language-multiple-choice,id2054abe9-c7eb-4580-abe1-32351c527300,She walked towards the forest and saw a deer.  ,idc1b74a92-94a9-4581-acf0-8103be522d04,She walked on a rope bridge.,id69f8a1c1-c875-4157-8968-8a474048e371,She walked on the platform.,id424e04e1-d442-4d72-9b2a-d976d3ba6650,She walked towards the banks of the river Ganga and got into a crowded boat. ,qti-choice-interaction,eb_u01l10a04q04
57ea2428b3fcec1309c4ec95.json,57ea2428b3fcec1309c4ec95,True,,qti,file-submission,question choice response id null,qti-upload-interaction-generic
57fd2b6ab3fcec0b1b2a4da9.json,57fd2b6ab3fcec0b1b2a4da9,False,"'We take a left at the junction there and walk straight down that road past the health centre. At the end of that road, we turn right. As we keep walking down the road we'll pass by the gram panchayat on our left. We take the first right and we'll be in the market.'Select the image that matches the route described above by Kanasu and Sahir. ",qti,multi-language,files,multi-language-multiple-choice,files,id0ae219e5-3f14-4df7-9b82-d0fcec1c231f,,id96ec1f7b-b612-4199-b43b-534feb01b3ef,,id113fff42-855b-42ac-a991-d9f183dd855e,,id4b2219fd-da6b-46c8-8ac9-e91206abc40e,,qti-choice-interaction,ee_u1l05a04q06
57fcd2f4b3fcec7e0a2029be.json,57fcd2f4b3fcec7e0a2029be,False,Where did Sringeri get his idea?,qti,multi-language,files,multi-language-multiple-choice,id2ff9d41b-d3bf-4097-bb5c-56ed83c7a978,In a big town near his village,idd1ac3f66-52e4-4e45-9e7f-2b52c6eab747,In a big town very far from his village,idc7e6dac9-e89d-472e-8a7d-24585dac17db,In far away markets in a town,id7bf8cdee-9c09-4935-952e-0c6539057687,In a far away town with markets,qti-choice-interaction,eb_u01l06a04q03
57f5508cb3fcec3154d6c59d.json,57f5508cb3fcec3154d6c59d,False,I can ask for and give directions.,qti,multi-language,multi-language-multiple-choice,idf2281285-98ec-41c6-9fef-62874f6d8ddd,Very easily,id6f76997a-068e-4d2a-a4fb-63fd281f69f0,Easily,ide4cf7284-e0c8-4607-a3d3-fc5b39856857,With some difficulty,idbd8ca7ef-e81e-43ee-b12a-f487f8c5e194,With great difficulty,qti-choice-interaction-survey,ee_u1l05a06q04
57ed0640b3fcec0ee7647c40.json,57ed0640b3fcec0ee7647c40,False,I can talk about human qualities.,qti,multi-language,multi-language-multiple-choice,idd0a70677-e8cf-4a27-bcfb-7818cdec6a48,Very easily,id7cfad954-db9b-445b-89eb-1f2fd57928f5,Easily ,id8ee3a19b-3e27-44e9-9e8b-468bb5830236,With difficulty ,id4ec8fc01-bc29-4950-9186-0e4b0ab23c60,With great difficulty ,qti-choice-interaction-survey,eb_u01l08a09q04
57f548eab3fcec3154d6bf8d.json,57f548eab3fcec3154d6bf8d,False,In order to improve my English I will:Speaking and Writing Activities,qti,multi-language,multi-language-multiple-choice,id371802a0-a2d2-4409-b6bb-bb1c8a52973d,  Practise speaking in English for at least 2 hours in a week.,ida09a5b83-2d82-4997-8efc-d6415d44df06,Tell a story/ make a short presentation in English at least once a month and record myself when possible.,idd7412623-524f-4194-a7fb-276a34d0c472,Speak with friends about daily life in English.,id2f385496-9e0d-4dcd-a20d-b83f9742291e,Speak to a teacher/teachers in English as often as possible.,id35542a45-4aee-430d-be6c-57b5b2ae5ffd,Make a notebook or journal to note down the English words/phrases that I learn.,qti-choice-interaction-multi-select-survey,ee_u1l03a06q02
58257248b3fcec0e0743af9d.json,58257248b3fcec0e0743af9d,False,"In the beginning, when Kanasu's aunt wants her to do something, what word does she use to request her help?",qti,multi-language,files,multi-language-multiple-choice,id803005dc-4900-46a2-ac5d-5a1d522b426a,Thank you,id4d5a9307-2212-4213-bb66-337d5a004cc6,Please,id4a56b0e3-d526-41c9-8dce-965cd5f3e2f9,Sorry,id1a3439e8-0ba8-4028-a0b8-0641e7f7c7b5,Just do it,qti-choice-interaction,ee_u01l09a04q07
57e8f376b3fcec1309c4dcb5.json,57e8f376b3fcec1309c4dcb5,True,,qti,file-submission,question choice response id null,qti-upload-interaction-audio
57eb9a3cb3fcec04647ef051.json,57eb9a3cb3fcec04647ef051,True,,qti,multi-choice-randomized,ordered-choice-text,id99e3e799-0354-49af-abc5-ee4eaff4ed79,qti-order-interaction-mw-sentence
57f54177b3fcec3154d6bb89.json,57f54177b3fcec3154d6bb89,False,I could do most of the activities,qti,multi-language,multi-language-multiple-choice,id84f435c8-320d-4de5-a767-511ade83158e,Very easily,iddd5f5f37-ddd9-457c-b4a8-742a1d223605,Easily,idc9219e77-b887-4817-a38f-6f5758c6f5db,With great difficulty,idb1312bdd-73d6-435c-a0da-9bff68151c8c,With difficulty,qti-choice-interaction-survey,ee_u1l01a05q06
5825721eb3fcec0e0743aeda.json,5825721eb3fcec0e0743aeda,False,Why does Fatima find it difficult to study?,qti,multi-language,files,multi-language-multiple-choice,id9d7e05f9-db31-477c-9118-fc719fc382e2,She finds some lessons difficult.,idd126ddbb-1ad3-4c0f-aeb7-f704ea928475,She finds time to study only after all the housework is done.,idc4b8868b-37f1-4903-9dd4-7b78337b2d94,She finds it difficult to understand.,idb68272c0-f10e-4d98-8fb4-c329719364d0,She finds studies uninteresting.,qti-choice-interaction,ee_u01l09a04q04
57ee0ae8b3fcec154609eb29.json,57ee0ae8b3fcec154609eb29,False,Only one of the following shapes has BOTH the properties given below:i) exactly one pair of equal sidesii) exactly one obtuse angleWhich one is it? ,qti,multi-language,files,multi-language-multiple-choice,id0e11d5c7-e9fd-41aa-936a-ed73dada6ace,A),id88f7049c-92df-4ce5-8999-c085e4a59523,B),iddc363a51-b612-459c-8796-d4260ddd3920,C),id1f77f067-6ea4-4277-87ff-9b723ca5ba17,D),qti-choice-interaction-survey,m1_u0l01a00q05
57f55054b3fcec3154d6c4f1.json,57f55054b3fcec3154d6c4f1,False,I can understand specific information.,qti,multi-language,multi-language-multiple-choice,id59b5df25-a38d-49ed-b45c-995199a66b86,Very easily,id6b8712b7-2f7c-4ab5-82d6-5e43e1cbb896,Easily,id53f99b05-50e8-4e1f-b8e8-65b60ece13fb,With some difficulty,id5a07815d-2558-436a-ac22-f16fff69cf98,With great difficulty,qti-choice-interaction-survey,ee_u1l05a06q02
57f54758b3fcec3154d6bf04.json,57f54758b3fcec3154d6bf04,False,"When the teacher asked the students to share their weekend experiences, she wanted to know what they did on -",qti,multi-language,files,multi-language-multiple-choice,id96d44f79-4c01-4686-9efa-a5223f0e18ee,Tuesday and Wednesday,idf641e451-5f38-4f54-9a98-a4f427370801,Thursday and Friday,idac3f0da8-8af8-451f-af83-3bf498d2a026,Saturday and Sunday ,id465886e6-04fe-4aa5-b56d-da69a5498896,Friday and Saturday,qti-choice-interaction,ee_u1l03a04q07
57e526f6b3fcec5f10d00d67.json,57e526f6b3fcec5f10d00d67,False,Idon'twanttomyteeth.,qti,qti-inline-choice-text,qti-inline-choice-interaction-mw-fill-in-the-blank
57ea202fb3fcec1309c4eb7f.json,57ea202fb3fcec1309c4eb7f,True,,qti,multi-choice-randomized,ordered-choice-text,id12de1a5b-8f40-44ea-92f5-0304dc410331,qti-order-interaction-mw-sandbox
57f16529b3fcec3154d6b02e.json,57f16529b3fcec3154d6b02e,False,I can talk about my views on certain matters.,qti,multi-language,multi-language-multiple-choice,id229fd73e-8549-4444-9d51-ac4ec3fd5111,Very easily,id5bbc6397-d7b4-4668-81e3-084a4fcf3e58,Easily ,id74c844be-bf88-48b7-9f48-10b10b1aee37,With difficulty ,id12eb291e-c074-4f56-ac78-ef3095b47bfe,With great difficulty ,qti-choice-interaction-survey,eb_u1l06a08q03
5820cb84b3fcec7d0b8b75d4.json,5820cb84b3fcec7d0b8b75d4,False,"Of the four images, which routine is NOT mentioned in the story?",qti,multi-language,files,multi-language-multiple-choice,idf89d9695-d79d-44e1-9108-2fdc38790a8e,Image 1: Zo cooking,id526fcd5b-c240-4ffe-ad4c-b92edfd726bf,Image 2: Zo sweeping the floor  ,id9dd23eb2-231a-47bf-954e-6be732e1a20f,Image 3: Sahir fetching water from the well with Fatima  ,idee39f1f9-eaf6-4069-bc9b-7b59554327ac,Image 4: Kanasu cooking breakfast  ,qti-choice-interaction,ee_u1l06a04q04
57ea296db3fcec1309c4f086.json,57ea296db3fcec1309c4f086,False,I can follow the details in a story.,qti,multi-choice-text,ide80355bf-b0dd-4dad-a668-3b240f51b55c,qti-choice-interaction-survey
57e62e1eb3fcec5f10d00ddd.json,57e62e1eb3fcec5f10d00ddd,False,I can put events in order.,qti,multi-choice-text,idf2d645e6-ee09-4092-a05d-4d5bab38d88b,qti-choice-interaction-survey
57ee4b87b3fcec154609ee49.json,57ee4b87b3fcec154609ee49,False,A scarecrow _______________,qti,multi-language,files,multi-language-multiple-choice,idfdff5c4f-9f27-474b-9dd8-c8c4efb13453,can keep people away.,id867ae1f9-e80e-4523-b0bf-f300b30768a1,can keep birds away.,id437c4ee1-2c00-4382-b6ef-bde50063b67d,can keep crows away.,idec8e255d-b288-408c-88e7-9ced6c7ba75a,can keep insects away.,qti-choice-interaction,eb_u01l09a07q03
582ad100b3fcec47978dda89.json,582ad100b3fcec47978dda89,False,Zoboughtfrom]{prep}[the]{other}[grocery.Healso spoke withKanasu's unclehappily.,qti,multi-language,multi-language-inline-choice,qti-inline-choice-interaction-mw-fill-in-the-blank,ee_u1l07a07q03
57f54734b3fcec3154d6be92.json,57f54734b3fcec3154d6be92,False,What does the class talk about in the first part of the story?,qti,multi-language,files,multi-language-multiple-choice,id3c8fef12-5b83-42ad-b36d-7022923fc7eb,Their family members,id22eb8e74-93e6-46c3-8484-309d2be80681,Their likes and dislikes,id9542850a-4efd-44c0-9a09-cb72956a433e,Their weekend activities,id12ac4b75-8e39-4f62-a91f-229e6deb546a,The places in their village,qti-choice-interaction,ee_u1l03a04q02
57ffccedb3fcec148d8e46be.json,57ffccedb3fcec148d8e46be,False,What is the correct sequence of people that the boy helped?,qti,multi-language,files,multi-language-multiple-choice,id2e28556c-e22b-41b9-ac3b-0c0ab93c8ae7,"old man, potter's wife, man with a horse, groom",id451cb0f5-b42b-45a1-9d7d-791578d93d58,"old man, potter's wife, washerman, groom, man with a horse",id63c1aa17-c460-4b69-b41b-bf8bf0e2fa1a,"old man, potter's wife, washerman, man with a horse, groom",id7f6e463a-7e06-4fb5-805a-27aca3558612,"old man, potter's wife, groom, man with a horse, washerman",qti-choice-interaction,eb_u01l08a08q02
57fbd42cb3fcec7e0a2026d9.json,57fbd42cb3fcec7e0a2026d9,False,"Which subjects have Kanasu, Zo and Sahir finished studying? ",qti,multi-language,files,multi-language-multiple-choice,id8ba88487-6c0a-4207-b66f-f75725bf7ce2,Science and Maths ,iddbeda75b-d1c2-4e45-82c0-85c73eed5ea4,Science and Geography ,idbfbdaa1c-abac-49e0-bf44-b65a7b36c65b,English and History ,id81d0781a-1b20-48fa-b245-f42bf05b75b4,History and Science ,qti-choice-interaction,ee_u1l04a04q03
57e8ff7cb3fcec1309c4e4b6.json,57e8ff7cb3fcec1309c4e4b6,False,"From the following images, which image is that of a 'junction'?",qti,files,multi-choice-text,id5e6b30b8-2cef-48f5-8140-514ca0259256,qti-choice-interaction
57ea291ab3fcec1309c4ef7f.json,57ea291ab3fcec1309c4ef7f,True,,qti,file-submission,question choice response id null,qti-upload-interaction-audio
57ee4b71b3fcec154609edef.json,57ee4b71b3fcec154609edef,False,What did Gauri want to help with?,qti,multi-language,files,multi-language-multiple-choice,files,id4c766e45-0fae-4b3c-9065-0c62cca02112,Putting clothes on the clothesline,id0925e813-a35e-4f3f-b427-21a47b13ac06,Folding clothes,idf0c13869-6ab4-4c17-858a-f93cc9a61149,Making scarecrows,idcdbc4f89-8356-491d-a164-3602e9b47607,Scaring away the birds,qti-choice-interaction,eb_u01l09a07q01
5820d145b3fcec7d0b8b7880.json,5820d145b3fcec7d0b8b7880,True,We can listen to others opinions. ,qti,multi-language,multi-choice-randomized,multi-language-multiple-choice,idd082c357-4eb8-428f-93b7-f5331d29b79c,Very Easily,id4510aac4-a97b-420a-8dac-8021204a92e1,Easily,id4f5b3547-066e-49f6-af32-378b737efa6a,With some difficulty ,id0744da24-c408-4651-a691-fbfa514fd6d0,With great difficulty ,qti-choice-interaction-survey,ee_u1l07a08q06
582be201b3fcec47978ddd1e.json,582be201b3fcec47978ddd1e,False,What quantities of vegetables does Zo want to buy?  ,qti,multi-language,files,multi-language-multiple-choice,id39f2ebd0-45ae-4043-b06e-b85c36715574,"A kilo of tomatoes, a half kilo of beans and a quarter kilo of onions",idd88e7735-853e-4ff1-ad90-b695346d722d,"A half kilo beans, a quarter kilo tomatoes and a kilo of onions.",id7117d3d3-d692-4847-b4c9-3a1085142c05,"A quarter kilo of beans, a half kilo of tomatoes, and a kilo of onions",id269f0395-9c7b-4e83-b2b7-f4bcf20b91c4,"A quarter kilo onions, a kilo of beans and a half kilo of tomatoes. ",qti-choice-interaction,ee_u1l07a04q02
57ea244fb3fcec1309c4ed2a.json,57ea244fb3fcec1309c4ed2a,False,I can use new words I learnt today from the stories. ,qti,multi-choice-text,id7992dd23-52c0-4521-81b0-78ce3896f38c,qti-choice-interaction-survey
57f164b9b3fcec3154d6af4e.json,57f164b9b3fcec3154d6af4e,True,,qti,multi-language,multi-language-file-submission,question choice response id null,qti-upload-interaction-audio,eb_u1l06a07q01
57ea2404b3fcec1309c4ec71.json,57ea2404b3fcec1309c4ec71,False,I can answer questions based on the story.,qti,multi-choice-text,ide9414f5d-d71b-43f0-a5f8-ff009eabb7b3,qti-choice-interaction-survey
582acf2cb3fcec47978dd9df.json,582acf2cb3fcec47978dd9df,False,the canalwill be builtin the village,qti,multi-language,multi-language-inline-choice,qti-inline-choice-interaction-mw-fill-in-the-blank,ee_u1l07a07q01
57f546e4b3fcec3154d6bd8a.json,57f546e4b3fcec3154d6bd8a,True,"Listen to the audio of Zo's self-introduction:ST 4: ""I like to repair things that don't work and sometimes I also like to repair things that work.""What does this tell you about Zo?",qti,multi-language,multi-choice-randomized,files,multi-language-multiple-choice,id731aa0d8-a6a0-48a8-9c14-5a3b08435fd2,He can joke about himself.,idec1a901c-7058-4c63-a5d3-24eedffdca50,He can get very excited when he starts repairing things.,idd22f3c49-7bb6-437c-af64-9282e2e0e9cb,He can spoil things that work.,idf8022945-1018-4322-bdc8-6660490f028d,He can make everything work.,qti-choice-interaction,ee_u1l03a04q08
5820cb9cb3fcec7d0b8b765a.json,5820cb9cb3fcec7d0b8b765a,False,"What do Kanasu, Sahir and Zo talk about in the story?",qti,multi-language,files,multi-language-multiple-choice,ide2f48b06-90eb-4f04-8da0-75f99faca454,Their goals,id40e5d110-6353-4ded-9a53-7145a634f81d,Their timetable,idb9c57434-c0df-43ee-bdf6-8e3ef54ece9d,Their daily routine,id92c4ee85-835c-482f-81b0-1cae037755f0,Their likes and dislikes,qti-choice-interaction,ee_u1l06a04q01
57fbd442b3fcec7e0a202712.json,57fbd442b3fcec7e0a202712,True,"When Sahir says ""Shall we take a break?"", he means - ",qti,multi-language,multi-choice-randomized,multi-language-multiple-choice,files,idbd20d396-d43d-40d9-9976-e562bd948f1b,Let us continue studying. ,id33b2a7a0-0462-4da9-88d6-d4ebf227243b,Let us stop studying. ,idf5723fd7-ff71-4e00-829b-0cddfa77fe39,Let us start studying. ,id2e0ae837-0c99-4a3a-a31b-e910b9961efa,Let us stop studying for some time. ,qti-choice-interaction,ee_u1l04a04q04
57f53aa4b3fcec3154d6b993.json,57f53aa4b3fcec3154d6b993,False,"In which of these sentences is the phrase ""pick me up"" used in the same way as in the story?",qti,multi-language,files,multi-language-multiple-choice,id2429e37e-6071-4e23-aa13-21abbbb4c59a,My father picked me up when I fell down from the swing.,id98241d73-b005-4cf2-ac5a-d1fc159d2ca1,I need a pick-me-up every morning before I go to work.,idfc80189a-13b0-4a33-9f4b-dcb3dbc606ab,My uncle came to pick me up from the market.,id113170bb-83b7-4518-9e5d-8b68bd8dce5d,"When I was one, my mother used to pick me up and carry me in her arms.",qti-choice-interaction,ee_u1l01a03q07
57eb9a45b3fcec04647ef076.json,57eb9a45b3fcec04647ef076,True,,qti,multi-choice-randomized,ordered-choice-text,idb4601aa8-2466-4209-b6d6-7201f247d5b3,qti-order-interaction-mw-sandbox
57f16504b3fcec3154d6afa1.json,57f16504b3fcec3154d6afa1,False,I can understand funny turn of events in a story.,qti,multi-language,multi-language-multiple-choice,id977d7157-55d4-4a4b-8804-f02b1c25a9eb,Very easily,id195c767b-4cbd-4093-916e-21cc89e244d4,Easily ,id441abc6c-aee2-487a-95e9-9fc25321c0ab,With difficulty ,id14b4906a-fbe8-43af-af51-25ceb5f01311,With great difficulty ,qti-choice-interaction-survey,eb_u1l06a08q01
57ee4bb8b3fcec154609ef00.json,57ee4bb8b3fcec154609ef00,False,I can understand imagination in stories. ,qti,multi-language,multi-language-multiple-choice,idbe43febd-e4ce-434a-9d45-4c5c34538104,Very easily ,idb9f23fa7-9751-4b28-9a3b-0ad26369725c,Easily ,ide17248dd-7d3c-4d6c-8699-8eefee5dc5b3,With difficulty,id39cc8276-c7bf-4c88-a18b-1e71f72d3289,With great difficulty. ,qti-choice-interaction-survey,eb_u01l09a08q01
57e90b99b3fcec1309c4e5ca.json,57e90b99b3fcec1309c4e5ca,True,Wemust brushourteethtokeepaway. ,qti,qti-inline-choice-text,qti-inline-choice-interaction-mw-fill-in-the-blank
57e8ff75b3fcec1309c4e452.json,57e8ff75b3fcec1309c4e452,False,"In the story you just heard, Kanasu is heard giving Zo directions from -",qti,files,multi-choice-text,id373eafd9-66cb-4abc-badd-a5da65360626,qti-choice-interaction
57e62e34b3fcec5f10d00dfb.json,57e62e34b3fcec5f10d00dfb,False,I can write how to do simple things.,qti,multi-choice-text,ida8f491b1-8f4a-4dd7-bfaa-b45c028a8107,qti-choice-interaction-survey
57ea2039b3fcec1309c4eb97.json,57ea2039b3fcec1309c4eb97,True,,qti,multi-choice-randomized,ordered-choice-text,idc2025966-d26e-44a7-8d87-6ade78377c2e,qti-order-interaction-mw-sandbox
57f54acdb3fcec3154d6c0de.json,57f54acdb3fcec3154d6c0de,False,I can introduce myself. ,qti,multi-language,multi-language-multiple-choice,id8b975d1b-9ee9-4aad-8609-51bff1d3c90c,Very Easily,id42028bd0-e974-4dde-828b-fbdf64423ec7,Easily,idddbb4dfc-98d4-4ca4-913b-7fd5477ce022,With difficulty ,id34d3fcf8-53aa-484b-aecd-5071fea2b12b,With great difficulty ,qti-choice-interaction-survey,ee_u1l03a07q05
58012b7eb3fcec148d8e4b3d.json,58012b7eb3fcec148d8e4b3d,True,"If you add 1 to a whole number you get a number less than 1,000,000,000,000,000,000,000.","अगर आप किसी पूर्ण संख्या में   1 जोड़ते हैं तो आपको ऐसी संख्या मिलेगी जो 1,000,000,000,000,000,000,000 से कम होगी।⃞ सही ⃞   गलत",qti,multi-language,multi-language-text-interaction,question choice response id null,qti-extended-text-interaction,m1_u05l15a05q04
57f54a8cb3fcec3154d6c057.json,57f54a8cb3fcec3154d6c057,True,My partner and I can share our likes/dislikes and discuss our goals with each other. ,qti,multi-language,multi-choice-randomized,multi-language-multiple-choice,id63aba899-14b9-4406-a40f-1f03a53a4e4d,Very Easily,id021fc3d0-5a1d-49ef-b11c-2123481ac334,Easily,id09884c18-5a6c-4f3f-bb67-ac4740597b24,With difficulty ,idd0d97dbf-c811-41de-b4da-9626f3b296af,With great difficulty ,qti-choice-interaction-survey,ee_u1l03a07q07
5823065ab3fcec0e07439e49.json,5823065ab3fcec0e07439e49,False,Sahir feels that Danny should be the one helping their father in the field because Danny has 'time on his hands'. This means that ______________  ,qti,multi-language,files,multi-language-multiple-choice,files,ide76694e4-66ba-43e0-857a-bb1cbfeccc93,Danny cares about time.,id9dc73c35-cf0a-4818-a43c-6a3dc2738c59,Danny has free time.,ida3e6e212-40fb-4fc6-b24a-acb5509387b4,Danny has no idea about time.,id8d92863d-8837-418e-8dad-75c7f501d017,Danny knows about time.,qti-choice-interaction,ee_u1l10a04q06
57fd0a0bb3fcec0b1b2a4bab.json,57fd0a0bb3fcec0b1b2a4bab,True,,qti,multi-language,multi-choice-randomized,files,multi-language-ordered-choice,id384d09a7-38b3-4df3-9a7a-3cd843b59556,"[A]{other""&gt;A",id379108ba-eb03-464c-bc0d-d239c59f8b03,car,id36fe8b73-12e8-460a-a40b-f63c71c97b0e,is,idcbe713f2-16ad-438e-8a61-789b3f02dcb6,moving,idc76b2e84-4c80-4645-8e4a-c44e84d63ddd,along,idc3fef63b-bf32-47ff-b063-5ae6a8abce3e,the street,id17f15027-7c75-4c19-9b6c-52cdfaeed312,.,qti-order-interaction-mw-sentence,ee_u1l05a02q03
57ecfa96b3fcec0ee7647921.json,57ecfa96b3fcec0ee7647921,False,Zo defines an isosceles triangle as ‘A triangle that has at least two equal sides.’ ,qti,multi-language,files,multi-language-multiple-choice,ide3ca6e8e-b189-4bfa-8918-b7ca5be040e4,A) Only Triangle 1 is isosceles. ,id73bb9160-60f4-47f2-8ae6-35ff89d435d7,B) Only Triangle 2 is isosceles.,id85e9c507-e062-4231-85aa-12e6140f7f07,C)  Both Triangle 1 and Triangle 2 are isosceles.,ide4a53200-321d-40f2-8b50-eeff728c4935,D) Neither of the triangles is isosceles.,qti-choice-interaction,m1_u0l00a00q09
57f49dc3b3fcec3154d6b187.json,57f49dc3b3fcec3154d6b187,True,I can talk with the help of prompts.,qti,multi-language,multi-choice-randomized,multi-language-multiple-choice,id206b6532-cb78-4a4d-8c05-75da6724f435,Very easily ,iddadfcaa4-f043-442c-a7e6-3dd8a5229176,Easily ,id1d1d41d1-2e6f-4cff-9ea3-247b41bfb7b6,With some difficulty,id53714bb6-2f51-48ca-ac1d-fed268109980,With great difficulty. ,qti-choice-interaction-survey,eb_u01l10a09q05
58206f19b3fcec7d0b8b71bf.json,58206f19b3fcec7d0b8b71bf,False,I can understand the good and bad effects of an event.,qti,multi-language,multi-language-multiple-choice,idf8a56d3d-e862-450c-bbed-75a2cddb5abe,Very Easily,idcf4fc710-ebdc-426e-919f-8d51bb5b72b6,Easily,id57e572e9-d789-4a65-b460-14380f86c308,With Some Difficulty,idfc99f01b-a95d-496c-9501-cb59fe08796d,With Great Difficulty,qti-choice-interaction-survey,ee_u1l08a06q01
57f5313bb3fcec3154d6b88f.json,57f5313bb3fcec3154d6b88f,False,"Listen to the audio. ""Now, we take a right here. Can you see the gate in front, Zo? That is your new home. Come, Sahir and Kanasu. Join us for some tea."" Which of these images best depicts the scene at Grandma's house?",qti,multi-language,files,multi-language-multiple-choice,ided853ef7-3103-4d0b-a17b-913449fd41b0,Kanasu and Sahir drinking tea at Grandma's house,idf30c9f73-6970-4a79-bafe-1b2dce9ba786,"Kanasu, Sahir and Zo drinking tea together, with Grandma watching",id8d4a8903-e136-4076-b318-57734f53c190,"Kanasu, Sahir, Zo and Grandma all sitting together on a mat on the kitchen floor drinking tea",id43f4b6f9-b429-4880-9f4f-87ec25660ee5,Grandma and Zo drinking tea as Sahir and Kanasu watch them,qti-choice-interaction,ee_u01l02a04q06
57f545e6b3fcec3154d6bcf9.json,57f545e6b3fcec3154d6bcf9,False,I can share information and opinions with my partner.,qti,multi-language,multi-language-multiple-choice,id4c7416f2-4846-4e41-9b8e-d537b65703cd,Very easily,idca740369-7b1e-4312-b7be-a1fd84706c83,Easily,id8c939540-04d1-431e-80e4-002158b5ea65,With difficulty,idb0b61c0f-b164-4a9a-92c1-dd066000407d,With great difficulty ,qti-choice-interaction-survey,ee_u1l02a06q05
57f16409b3fcec3154d6aead.json,57f16409b3fcec3154d6aead,False,Sringeri Srinivasavery badday.,qti,multi-language,multi-language-inline-choice,qti-inline-choice-interaction-mw-fill-in-the-blank,eb_u1l06a03q01
57f49d8fb3fcec3154d6b0e7.json,57f49d8fb3fcec3154d6b0e7,True,I can understand the details in a story.,qti,multi-language,multi-choice-randomized,multi-language-multiple-choice,id3edea3c7-779a-4c13-b5e2-b6c2f9b68b15,Very easily ,idcddb9f6c-032b-4744-b886-6e36a0d85f9f,Easily ,idee912ea4-3003-423c-8f04-c66d1aba42f2,With difficulty,idff16902f-776c-4682-abc9-594d35586273,With great difficulty. ,qti-choice-interaction-survey,eb_u01l10a09q01
57ea2970b3fcec1309c4f0aa.json,57ea2970b3fcec1309c4f0aa,False,I can talk about my experiences.,qti,multi-choice-text,id7c41f689-e307-4bc7-80e3-a02cb10468a2,qti-choice-interaction-survey
57ecfaadb3fcec0ee7647984.json,57ecfaadb3fcec0ee7647984,True,"‘If you add two odd numbers you will get an even number.’Say if the above statement is true or false, and give reasons for your answer.",qti,multi-language,multi-language-text-interaction,question choice response id null,qti-extended-text-interaction,m1_u0l00a00q14
584409b9b3fcec051a40ea80.json,584409b9b3fcec051a40ea80,True,नीचे दिए गए चित्र में ABC एक त्रिभुज है और DE एक सीधी रेखा है। कोण ACE का माप बताएं। अपने उत्तर के कारण बताएं।,qti,multi-language,files,multi-language-text-interaction,question choice response id null,qti-extended-text-interaction,m1_u00l00a02q13
5820d083b3fcec7d0b8b784c.json,5820d083b3fcec7d0b8b784c,False,I can describe my daily routine.,qti,multi-language,multi-language-multiple-choice,id3fe34d8e-8470-43b2-9e3e-221c2689f478,Very easily,idfc30b171-955a-472e-a126-3863aaecc0b9,Easily,id46303adf-c829-43b3-9e53-9b13194df2a8,With some difficulty,id6f7ca96f-14aa-4fde-86f6-d457f4076023,With great difficulty,qti-choice-interaction-survey,ee_u1l06a06q03
57ee0ad6b3fcec154609eadc.json,57ee0ad6b3fcec154609eadc,False,In which of these figures are the lines parallel? ,qti,multi-language,files,multi-language-multiple-choice,id32a64381-fd10-410a-aff4-b767e0a92d8a,"A) only P, R and S",id8ff4e6c7-9d23-4f39-aad0-ce0e7e008fc2,B) only P,id63d0516c-ccac-49bf-b4d7-47bfe4f1b3d0,C) only P and S,id6303dced-36a9-41c2-b323-f3504e57d6c9,D) only Q,qti-choice-interaction-survey,m1_u0l01a00q02
581c2951b3fcec45a7c916aa.json,581c2951b3fcec45a7c916aa,True,,qti,multi-language,multi-choice-randomized,multi-language-ordered-choice,files,id104292e2-7522-447c-a5fc-ef6769bcf6b8,Thousand,id344adefc-e768-46cd-af9d-4438e0559315,grammes,id7499ebf4-5c7d-4de2-aad2-ccb03b9b1316,make,idceca51f2-70f0-4609-a149-c89caad43a11,a,id63277887-da4a-4f0f-b10d-bf86abf27d3b,kilo.,qti-order-interaction-mw-sandbox,ee_u1l07a06q04
57ea2975b3fcec1309c4f0d2.json,57ea2975b3fcec1309c4f0d2,True,I can write dialogues.,qti,multi-choice-randomized,multi-choice-text,id058de403-d061-4e59-bff0-6f6cb407c9fc,qti-choice-interaction-survey
57ee1312b3fcec154609ec82.json,57ee1312b3fcec154609ec82,True,Upload Here,qti,multi-language,multi-language-file-submission,question choice response id null,qti-upload-interaction-generic,m1_u1l01a01q02
