57f49dacb3fcec3154d6b137.json,57f49dacb3fcec3154d6b137,True,I can answer questions based on a story.,qti,multi-language,multi-choice-randomized,multi-language-multiple-choice,id09d3da7a-c156-4bc5-b1b0-1f73cb9cd4f3,Very easily ,ida7f82939-0396-494e-991b-4a2a6b913179,Easily ,idadba890f-89f8-4717-852b-5ed062d4c3f0,With difficulty,id12fa5aad-59f7-4e81-867f-70ef36bf5afb,With great difficulty. ,qti-choice-interaction-survey,eb_u01l10a09q03
57ecfa83b3fcec0ee76478b8.json,57ecfa83b3fcec0ee76478b8,False,Only one of the following shapes has BOTH the properties given below:i) exactly one pair of equal sidesii) exactly one obtuse angleWhich one is it? ,qti,multi-language,files,multi-language-multiple-choice,id0e11d5c7-e9fd-41aa-936a-ed73dada6ace,A),id88f7049c-92df-4ce5-8999-c085e4a59523,B),iddc363a51-b612-459c-8796-d4260ddd3920,C),id1f77f067-6ea4-4277-87ff-9b723ca5ba17,D),qti-choice-interaction,m1_u0l00a00q05
57ee4bd0b3fcec154609ef56.json,57ee4bd0b3fcec154609ef56,False,I can write sentences to describe an image.,qti,multi-language,multi-language-multiple-choice,id75991764-5322-4e0c-84cb-75a96d7afae9,Very easily ,id6246110a-7422-481a-b7fb-f5be6ce634d2,Easily ,iddd141464-5908-4056-96c0-321571df1a37,With difficulty,idb1a300c5-01a6-4ef2-95ac-2458863f3710,With great difficulty. ,qti-choice-interaction-survey,eb_u01l09a08q03
57ee4b94b3fcec154609ee76.json,57ee4b94b3fcec154609ee76,False,What did Gauri see the scarecrows doing?,qti,multi-language,files,multi-language-multiple-choice,id8e987052-1af5-4d5a-ae22-460d2353a9a6,They were waving their hands.,id48178e79-7984-4974-8c3f-e876fe209096,They were walking in the fields.,ide7460550-bac3-481d-9848-4c66fa992c1d,They were keeping the birds away.,id6cba2d7f-e6e8-4412-978c-7345a88b2fca,They were having fun.,qti-choice-interaction,eb_u01l09a07q04
57fcd2adb3fcec7e0a202987.json,57fcd2adb3fcec7e0a202987,False,What is the correct sequence of the people who did not want Sringeri's bananas?,qti,multi-language,files,multi-language-multiple-choice,idccf1b829-3efd-4299-8676-4594271438c7,"Family, traders, farmers.",id7a1021fa-8dbd-429d-b98f-8aa73f56e22a,"Family, farmers, friends.",idbd10188f-bd03-47ad-91d2-ab8d1a2920df,"Family, neighbours, friends.",idbd42263e-9b90-4317-ad62-6db665a86b9c,"Family, sons, friends.",qti-choice-interaction,eb_u01l06a04q02
57e8cc6db3fcec1309c4da98.json
57ee0af0b3fcec154609eb4d.json,57ee0af0b3fcec154609eb4d,False,Which of these names would fit ALL the shapes given below?,qti,multi-language,files,multi-language-multiple-choice,id0835dc0e-5646-4668-8cad-9e0393cad7d0,A) parallelogram,id135f941b-3ae6-4c6b-b5ea-5558201a4bf2,B) rhombus,idca1f7c6d-8320-419a-a31f-0c769179245a,C) rectangle,id6a079382-1516-4bc4-8e00-b9ebedc1511b,D) square,qti-choice-interaction-survey,m1_u0l01a00q06
57f53ad9b3fcec3154d6ba7f.json,57f53ad9b3fcec3154d6ba7f,False,Which of these statements from the story is NOT an example of an introductory greeting? ,qti,multi-language,files,multi-language-multiple-choice,id7e7b095e-9487-4678-9f59-160206003a86,Hello! ,id700233e6-6ad4-4cff-bb15-1c98f2705b6e,Hi! ,idcb221558-6ff5-453d-8bdd-057e337af7c6,I'm sorry,id968179c2-1751-43fc-a2fa-d21e3c965bc9,I don't think we have met before. ,qti-choice-interaction,ee_u1l01a03q08
57e8f370b3fcec1309c4dc96.json,57e8f370b3fcec1309c4dc96,True,,qti,file-submission,question choice response id null,qti-upload-interaction-audio
582be25eb3fcec47978dde42.json,582be25eb3fcec47978dde42,False,Kanasu's uncle said that the vegetables were expensive because,qti,multi-language,files,multi-language-multiple-choice,id9e65ce83-c611-4c50-aed3-986d51e57c2a,Chotapur had had a lot of rain.,idd5805ff4-7830-4bb6-906e-bf983defe519,it had not rained enough in Chotapur.  ,id96c21135-c1e6-4116-be35-a398b43ab236,Chotapur had had unseasonal rains.  ,iddd10faed-9129-49b2-bf8e-ecb69aa35deb,any of the above.  ,qti-choice-interaction,ee_u1l07a04q03
57ee0b01b3fcec154609eb9a.json,57ee0b01b3fcec154609eb9a,False,Zo defines an isosceles triangle as ‘A triangle that has at least two equal sides.’ ,qti,multi-language,files,multi-language-multiple-choice,ide3ca6e8e-b189-4bfa-8918-b7ca5be040e4,A) Only Triangle 1 is isosceles.,id73bb9160-60f4-47f2-8ae6-35ff89d435d7,B) Only Triangle 2 is isosceles.,id85e9c507-e062-4231-85aa-12e6140f7f07,C)  Both Triangle 1 and Triangle 2 are isosceles.,ide4a53200-321d-40f2-8b50-eeff728c4935,D) Neither of the triangles is isosceles.,qti-choice-interaction-survey,m1_u0l01a00q09
57f54704b3fcec3154d6be08.json,57f54704b3fcec3154d6be08,False,"Sahir tells Zo,'You can sit next to me.' He means that Zo can sit ...........him.Fill in the blank with a suitable word from the following:",qti,multi-language,files,multi-language-multiple-choice,idcaed5f44-7aab-418c-99ca-43a3361e59ec,beneath,ide699237a-f514-498f-9cec-8a85613e7e9d,beside,idd40ff276-5d8b-4a6b-ba78-29b3a1189f62,behind,id56c1aa24-e1db-40ad-bb3f-38838b7b22df,in front of,qti-choice-interaction,ee_u1l03a04q06
58206f45b3fcec7d0b8b7296.json,58206f45b3fcec7d0b8b7296,False,I can enjoy having a discussion with my friends.,qti,multi-language,multi-language-multiple-choice,id5c0dac2d-4df5-40d5-88bc-3dd9e7f0aee2,Very Easily,idba756480-c795-4415-ba26-aa35103116ba,Easily,idd8861a55-0e15-40c8-8e76-695d9c1cf540,With Some Difficulty,idd029c648-6d94-4d13-94be-b28103908769,With Great Difficulty,qti-choice-interaction-survey,ee_u1l08a06q06
58440994b3fcec051a40ea0c.json,58440994b3fcec051a40ea0c,False,"ज़ो ने एक समद्विबाहु त्रिभुज को इस प्रकार परिभाषित किया, ‘एक ऐसा त्रिभुज जिसके पास कम-स-कम दो बराबर भुजाएं हो’ज़ो की परिभाषा के अनुसार इनमें से कौन सा कथन सही है?",qti,multi-language,files,multi-language-multiple-choice,iddfecdbc1-00e2-4db4-9453-9e42cdcf86f3,केवल त्रिभुज 1 समद्विबाहु है|,id2a74fe22-5d1c-4385-8056-5470139dd08a,केवल त्रिभुज 2 समद्विबाहु है|,id5692d77a-a86a-405a-becd-72d415ab22a6,दोनों त्रिभुज 1 और त्रिभुज 2 समद्विबाहु है|,id5f53d065-3c0f-4537-8d68-1504168c0c22,इनमें से कोई भी त्रिभुज समद्विबाहु नहीं है |,qti-choice-interaction,m1_u00l00a02q09
57ee130cb3fcec154609ec71.json,57ee130cb3fcec154609ec71,True,Upload Here,qti,multi-language,multi-language-file-submission,question choice response id null,qti-upload-interaction-generic,m1_u1l01a01q01
582be282b3fcec47978dded4.json,582be282b3fcec47978dded4,False,"In this story, we see that Zo impresses Kanasu's uncle with his - ",qti,multi-language,files,multi-language-multiple-choice,ide6d0c50e-a6ff-400b-9d01-843b1a7b926c,quick calculation. ,idb8731ae8-533e-4f20-80c3-9d2b98a46ed7,understanding of social problems - such as the building of the canal.,id34ecd032-c203-4036-bce4-ec9ee0fa7f0c,good conversation. ,idc496f66a-6d66-4101-81bc-13583355290d,bargaining ability. ,qti-choice-interaction,ee_u1l07a04q06
57ea25b0b3fcec1309c4ee25.json,57ea25b0b3fcec1309c4ee25,True,,qti,file-submission,question choice response id null,qti-upload-interaction-audio
57ecfa88b3fcec0ee76478da.json,57ecfa88b3fcec0ee76478da,False,Which of these names would fit ALL the shapes given below?,qti,multi-language,files,multi-language-multiple-choice,id0835dc0e-5646-4668-8cad-9e0393cad7d0,A) parallelogram,id135f941b-3ae6-4c6b-b5ea-5558201a4bf2,B) rhombus,idca1f7c6d-8320-419a-a31f-0c769179245a,C) rectangle,id6a079382-1516-4bc4-8e00-b9ebedc1511b,D) square,qti-choice-interaction,m1_u0l00a00q06
57fd2b4cb3fcec0b1b2a4d43.json,57fd2b4cb3fcec0b1b2a4d43,False,We can also say that Kanasu is describing the .............. from the playground to the village market.Fill in the right word from the given choices. ,qti,multi-language,multi-language-multiple-choice,files,ide20d7c1e-7c69-4efa-8cf0-9ebf6a505363,map   ,ida942d730-a2bb-463c-8e89-056afc839492,steps ,idb97e104a-95c3-4960-97bd-5e1e972bcebc,method ,id067edc39-ce53-4101-b4e9-76377544b581,route ,qti-choice-interaction,ee_u1l05a04q04
57f5310eb3fcec3154d6b7d8.json,57f5310eb3fcec3154d6b7d8,False,"When Kanasu says that her uncle will lose his land, she means that -",qti,multi-language,files,multi-language-multiple-choice,ida870016a-bcb9-48c6-82cf-a141c29dca27,his land has loose soil.,id878263af-274e-47c1-97ca-c936544a1f5a,he has not fenced his land properly.,id6d9a55ed-ae02-4815-8dc6-24de64f0203f,he will not be able to find his land.,idfea1e641-6c10-4580-96a4-a16e1fc17f6d,he will have to give up his land to the canal project.,qti-choice-interaction,ee_u01l02a04q07
57f548cfb3fcec3154d6bf3f.json,57f548cfb3fcec3154d6bf3f,False,Sharing Knowledge Activities,qti,multi-language,multi-language-multiple-choice,idbd176594-3b88-4e43-8a09-e9238c3ebca9,"Teach an English speaking skill that I have learned to a friend or family member (like introducing myself, talking about my likes/dislikes etc.).",ide1fb8058-b580-4e3d-b2e2-f7b91bb25e76,Listen to my friends/familiy members and help them improve their English.,id42e22c89-920f-45bd-b12d-84a2dcf731d2,Write what I learnt in class in English and share my notes with my classmates.,id8967be56-56e0-4cd7-958d-8d10e3fe3c2e,Discuss any new information I read or heard in English with my friends.,id74a4ce74-5fa3-4173-8e0e-5e914b83b791,Email the CLIx English team about my experience.,qti-choice-interaction-multi-select-survey,ee_u1l03a06q03
57ecfab2b3fcec0ee7647993.json,57ecfab2b3fcec0ee7647993,True,"‘If you add two even numbers you will get an odd number.’Say if the above statement is true or false, and give reasons for your answer.",qti,multi-language,multi-language-text-interaction,question choice response id null,qti-extended-text-interaction,m1_u0l00a00q15
58206f23b3fcec7d0b8b71ea.json,58206f23b3fcec7d0b8b71ea,False,I can understand points of view and opinions.,qti,multi-language,multi-language-multiple-choice,idf49bd32a-43a4-48eb-9a78-496bbeddbafc,Very Easily,id305088d5-8325-48a2-bbdb-aaa7368add95,Easily,id24be255a-50cf-468d-9082-efccad7a2566,With Some Difficulty,id25cf1dcd-2af7-43e1-8485-d50816358d74,With Great Difficulty,qti-choice-interaction-survey,ee_u1l08a06q02
57ed061eb3fcec0ee7647bee.json,57ed061eb3fcec0ee7647bee,False,I can follow the details in a story.,qti,multi-language,multi-language-multiple-choice,id749756a1-0484-47bc-90d8-5e153f1021ce,Very easily,id693a47ce-4ce8-441b-960b-c08154099b49,Easily ,iddc359aa3-c6b1-4379-9978-a0b60f217054,With difficulty ,id5e064e2d-c138-41c0-bc32-e6e52d84acf2,With great difficulty ,qti-choice-interaction-survey,eb_u01l08a09q02
5825722eb3fcec0e0743af1b.json,5825722eb3fcec0e0743af1b,False,Fatima says that Kanasu is lucky because -,qti,multi-language,files,multi-language-multiple-choice,idd78ffcb2-ae0a-43c8-8863-6016d2b04c1f,Kanasu's aunt can help her.,id588f1694-ab0d-4839-a6bf-db4222cab071,Kanasu's mother can help her study.,id7c0264c8-599c-4fe0-81f3-a3831fe7ab16,Kanasu can help her mother.,id901031aa-e629-467f-a8f8-9c2e4ed380b8,Kanasu has an aunt to help her mother.,qti-choice-interaction,ee_u01l09a04q05
5820ec39b3fcec7d0b8b7cb3.json,5820ec39b3fcec7d0b8b7cb3,True, ,qti,multi-language,multi-choice-randomized,multi-language-ordered-choice,ide71bfddb-526b-49e6-94af-fb70a7cd0992,A,id8f85b82e-1682-42a8-909e-1856d022bedf,complex,id17083d7f-ff52-4059-a930-7b3c6dc74a42,issue,id9e9c83e3-498c-4708-b428-e65be1848d58,would,idffbfbda9-53f3-4063-9896-91f4785b254c,have,idb213512f-8ff8-484e-836c-a412e2142827,many,id105e6fe8-ae67-4ce3-b9eb-341eca74f56a,perspectives.,qti-order-interaction-mw-sandbox,ee_u1l07a06q06
57ea2916b3fcec1309c4ef6a.json,57ea2916b3fcec1309c4ef6a,True,,qti,file-submission,question choice response id null,qti-upload-interaction-audio
57ea1fd7b3fcec1309c4eaeb.json,57ea1fd7b3fcec1309c4eaeb,False,I can understand cause-and-effect statements.,qti,multi-choice-text,id69e946e9-443e-4eed-8d91-481b4a94c3d3,qti-choice-interaction-survey
5824211cb3fcec0e0743a35e.json,5824211cb3fcec0e0743a35e,False,I can write simple sentences about possible events in a story.,qti,multi-language,multi-language-multiple-choice,ida46028e3-c59f-433e-b85e-c2645d7c3c69,Very Easily,id5925a0b5-c00a-4980-ae6d-9f51f0d3e8a9,Easily,idacc12902-34e9-48eb-9c32-cc16b4023228,With Some Difficulty,idf775b0a9-3d30-4cfe-a074-f051f78226af,With Great Difficulty,qti-choice-interaction-survey,ee_u1l10a06q04
57f54a9eb3fcec3154d6c08c.json,57f54a9eb3fcec3154d6c08c,False,I can understand when others introduce themselves.,qti,multi-language,multi-language-multiple-choice,idae1167a4-7efd-453a-9cca-a9191eeb5fc7,Very Easily,idb886e7ce-77f3-4890-8ac8-b84c1d26d666,Easily,id71fb1275-5e83-4647-a831-ff5b79ce4b8e,With difficulty ,id6b50fe16-8fc0-4c26-a3d3-29bf4295dab8,With great difficulty ,qti-choice-interaction-survey,ee_u1l03a07q01
58256cb3b3fcec0e0743acf6.json,58256cb3b3fcec0e0743acf6,False,"From the story, what did you learn about new developments such as building a dam?",qti,multi-language,files,multi-language-multiple-choice,id6b58528b-e3d5-41b0-acad-8396de9a5d6b,It may have good or bad results.,id5569067a-162b-42a4-8a9f-63518a39f07c,It is always good.,id91e9aedd-061d-4805-9294-2d82cd2d5a07,It is always bad.,id50c1c051-e8bc-4842-96b3-a35d52a2aca2,It results in what we expect.,qti-choice-interaction,ee_u1l08a04q06
57ed060fb3fcec0ee7647bc5.json,57ed060fb3fcec0ee7647bc5,False,I can understand the message in a story.,qti,multi-language,multi-language-multiple-choice,id32a3a89f-ce26-4e60-96de-520870c8362b,Very easily,id6814b48e-025d-421c-a7ff-e70979406d2e,Easily ,idcb047296-c3a2-4210-8b06-cedd8c604d66,With difficulty ,id2d688c8a-694e-4cf4-9646-fa07e46ebecf,With great difficulty ,qti-choice-interaction-survey,eb_u01l08a09q01
57eb5b96b3fcec04647eef05.json,57eb5b96b3fcec04647eef05,True,,qti,file-submission,question choice response id null,qti-upload-interaction-audio
57ea2849b3fcec1309c4ef21.json,57ea2849b3fcec1309c4ef21,False,I can talk about what I like.,qti,multi-choice-text,id72c0c697-c69b-45db-8974-e55d5ac98d81,qti-choice-interaction-survey
58440981b3fcec051a40e9ce.json,58440981b3fcec051a40e9ce,False,"ऐसा एक गुणधर्म बतायें जो सभी आयत के पास है, लेकिन कुछ समानांतर चतुर्भुज के पास नहीं भी हो सकते है।",qti,multi-language,multi-language-multiple-choice,id499467cc-2351-4a7a-8964-91ad357439fe,समानांतर भुजाओं के केवल दो जोड़े।,id61fb2228-051f-4520-9a76-b76a03ab9880,समानांतर भुजाओं का केवल एक जोड़ा।,id77dcf1bd-ed3f-4e5e-90b7-8143b706399f,सभी कोण समकोण हैं।  ,id1eeada49-13eb-4001-8d6d-7b88290b6e16,आमने-सामने वाली भुजाएं बराबर हैं।,qti-choice-interaction,m1_u00l00a02q07
5820d151b3fcec7d0b8b78bd.json,5820d151b3fcec7d0b8b78bd,False,We can understand the difference between what is definite and what might happen. ,qti,multi-language,multi-language-multiple-choice,id453dfdc9-3c29-4e2b-9e2d-f756186d7195,Very easily,ida8de0a76-a877-46d3-bb22-23a726c9e104,Easily,id4d23f89c-a19d-4a44-9f9f-304b6b9185d4,With some difficulty ,id742b595e-afa8-44ee-a160-ce7cd5e1e3a4,With great difficulty ,qti-choice-interaction-survey,ee_u1l07a08q03
57e8ff80b3fcec1309c4e4e8.json,57e8ff80b3fcec1309c4e4e8,False,"'We take a left at the junction there and walk straight down that road past the health centre. At the end of that road, we turn right. As we keep walking down the road we'll pass by the gram panchayat on our left. We take the first right and we'll be in the market.'Select the image that matches the route described above by Kanasu and Sahir.",qti,files,multi-choice-text,id0ae219e5-3f14-4df7-9b82-d0fcec1c231f,qti-choice-interaction
57ea23feb3fcec1309c4ec31.json,57ea23feb3fcec1309c4ec31,False,I can understand what the characters feel about something. ,qti,multi-choice-text,ida0216e67-7e00-4890-998e-209000f90455,qti-choice-interaction-survey
57fd2b33b3fcec0b1b2a4ced.json,57fd2b33b3fcec0b1b2a4ced,False,What do the friends decide to do when the story begins?,qti,multi-language,multi-language-multiple-choice,files,idf82279e6-450a-46e8-b976-28de279c2cc2,They decide to go to the village market.,id78d4e165-1fed-4063-a1c3-22cf2ba325fc,They decide to take another round of the playground.,ida79a79a9-a90d-4038-adaa-c13879e731a1,They decide to follow a path leading to the fields.,idcbe76d8e-4ce1-41ee-913f-37b6bdbc23f4,They decide to go and see the canal.,qti-choice-interaction,ee_u1l05a04q02
57ea2913b3fcec1309c4ef59.json,57ea2913b3fcec1309c4ef59,True,,qti,file-submission,question choice response id null,qti-upload-interaction-audio
582be276b3fcec47978dde8b.json,582be276b3fcec47978dde8b,False,What will happen when the canal is built?  ,qti,multi-language,files,multi-language-multiple-choice,id547f0ab7-9d88-4fd5-ba2b-f0faea9cffda,Kanasu's uncle will have no land to grow vegetables.  ,id73592314-ef86-4ca3-be6c-be3e8f8206c6,Kanasu's uncle will move away to a far away place to buy land.,id7c6bc61d-8b45-4973-a2bc-3d1da51879ba,Kanasu's uncle will not be able to grow crops.  ,idee0c6fd2-fb9b-41fc-90fb-1740dfc7368c,Kanasu's uncle will have less land to grow vegetables.  ,qti-choice-interaction,ee_u1l07a04q05
57f545c6b3fcec3154d6bc72.json,57f545c6b3fcec3154d6bc72,False,I could do most of the activities.,qti,multi-language,multi-language-multiple-choice,id479b8da7-1484-4271-808d-d112f3442af9,Very easily,id11029e11-d103-426f-9c3a-ef66619dc989,Easily,id050efabe-7ea4-43bd-a392-f74195b599db,With difficulty ,id703b5d39-9518-442f-ab5d-04b42a409176,With great difficulty ,qti-choice-interaction-survey,ee_u1l02a06q06
57f5311cb3fcec3154d6b815.json,57f5311cb3fcec3154d6b815,False,How old was Zo's brother Ingo when Grandma last saw him?,qti,multi-language,files,multi-language-multiple-choice,id6e2f49cb-254a-41d8-a6f1-1f4144790da6,  Young child of four,id25c6fcbf-6631-43ee-8c78-32130ab6d6d9,New born infant,idb5cc3fe8-321b-4b2c-8811-82b71c474d27,A toddler,idf1973e3f-f4f0-4945-b932-c96241bc12ba,Young child of ten,qti-choice-interaction,ee_u01l02a04q03
57ee4b7bb3fcec154609ee1c.json,57ee4b7bb3fcec154609ee1c,False,What did Gauri bring to make the scarecrow look lovely? ,qti,multi-language,files,multi-language-multiple-choice,files,idc530f992-d350-4821-93d2-ecc3344de0dd,New shoes and bags,id76554893-e764-4b02-ac5e-366f5448d278,New pink frock and ribbons,id7fff9906-a298-422b-a081-0b403d183421,New red frock and red ribbons,ide45f47a3-8f83-4014-b3a1-5eef5e65a732,New red pants and shirts,qti-choice-interaction,eb_u01l09a07q02
57ea283fb3fcec1309c4eeb8.json,57ea283fb3fcec1309c4eeb8,False,I can understand stories.,qti,multi-choice-text,idb40db576-42fb-44b9-a82c-27b1b3ceab12,qti-choice-interaction-survey
57ecfa7eb3fcec0ee76478a3.json,57ecfa7eb3fcec0ee76478a3,False,Which of these properties is true in every parallelogram? ,qti,multi-language,multi-language-multiple-choice,id3267abdf-f68d-44cd-9eb5-f10bd63ce463,A) All the sides are of equal length.,idb376b995-6f47-4dca-9eb1-250b79b51c08,B) There are two sets of parallelsides.,id9cf68097-0c06-4286-961f-8eb4a3f9b76e,C) Diagonals bisect each other at 90 degrees.,idebf3db5b-7100-4f9f-8a34-84f8edc0e236,D) All the angles are equal.,qti-choice-interaction,m1_u0l00a00q04
57ee5efeb3fcec154609f163.json,57ee5efeb3fcec154609f163,True,,qti,multi-language,multi-language-file-submission,question choice response id null,qti-upload-interaction-generic,m1_u1l01a02q01
57ee4b9fb3fcec154609eea3.json,57ee4b9fb3fcec154609eea3,False,Ma held Gauri tight because,qti,multi-language,files,multi-language-multiple-choice,id9da9412c-b72c-42d6-9115-ff21fa31d0e8,Gauri was scared by the dream.,id182b639c-9718-4013-b8ef-99f6a66139b4,Gauri was scared of the scarecrows.,id263c46a9-bd5f-4f0c-a8e6-f936a3d08599,Gauri was bitten by the birds.,id61f85ef7-bcd7-4e9d-a9a1-3f01a266ab5d,Gauri was hit by the birds.,qti-choice-interaction,eb_u01l09a07q05
57ea23fbb3fcec1309c4ec11.json,57ea23fbb3fcec1309c4ec11,False,I can understand actions one after another. ,qti,multi-choice-text,idd8ed5d9a-e647-4ea8-9b3b-d2f5780b5007,qti-choice-interaction-survey
584409afb3fcec051a40ea65.json,584409afb3fcec051a40ea65,True,"मान लीजिए ऐसे सभी आकृतियों को 'बबलू' नाम दिया जाए जिसके पास बराबर भुजाओं का केवल एक जोड़ा हो, तो इनमें से कौन कौन 'बबलू' हैं ? समझायें क्यों।",qti,multi-language,files,multi-language-text-interaction,question choice response id null,qti-extended-text-interaction,m1_u00l00a02q12
57f545d0b3fcec3154d6bc9f.json,57f545d0b3fcec3154d6bc9f,False,I can understand the gist of the conversation in the audio story.,qti,multi-language,multi-language-multiple-choice,id30fc7dc3-c49c-411f-be90-85f8faea7f1b,Very easily,id84d776b7-3aa1-45d4-bca7-11aac479c9a5,Easily,id0fb09923-bcab-455b-b0b3-502528750d8f,With difficulty,ide184a432-1a33-41de-80b1-61611ee7b16f,With great difficulty ,qti-choice-interaction-survey,ee_u1l02a06q01
57e8ff89b3fcec1309c4e57e.json,57e8ff89b3fcec1309c4e57e,False,"Why did Kanasu, Sahir and Zo not finish their adventure? ",qti,files,multi-choice-text,id6c86115d-ffb4-4c01-9b8c-ad5e607bc4c8,qti-choice-interaction
58230679b3fcec0e07439f06.json,58230679b3fcec0e07439f06,False,"When Danny asks Sahir to prepare to welcome his new Science teacher, Sahir replies _____________",qti,multi-language,files,multi-language-multiple-choice,files,idc6f0198a-cb85-4432-96ae-5aba09a37c15,"""I don't know when he's coming.""  ",idf76bca42-45c7-4905-a5a8-93c78f0b2b53,"""Why don't you welcome him?""",id0e124da8-8679-4a53-ad7d-518f36afbde8,"""Why should I welcome him?""",id2f5676f6-8631-4d21-abac-7d7ea7b6897e,"""That's a good idea. We might just do that...""",qti-choice-interaction,ee_u1l10a04q07
57f16511b3fcec3154d6afd0.json,57f16511b3fcec3154d6afd0,False,My friend and I could do the activities in the lesson.,qti,multi-language,multi-language-multiple-choice,id10eaf6b0-0901-4bec-b8bb-ccaab9ba6203,Very easily,id756131f1-1944-4248-8a90-af3db1225759,Easily ,id79b2808a-e4ca-4dc4-9fd9-332198915528,With difficulty ,id1a8f2876-59d4-47b7-95bf-99eb6f0f0f3c,With great difficulty ,qti-choice-interaction-survey,eb_u1l06a08q04
57ea2845b3fcec1309c4eefe.json,57ea2845b3fcec1309c4eefe,False,I can talk about work.,qti,multi-choice-text,idb5e6588e-f418-496f-ad72-917a8e3bfba3,qti-choice-interaction-survey
57e8ff83b3fcec1309c4e51a.json,57e8ff83b3fcec1309c4e51a,False,"Kanasu says, ""Let's follow the path"". What does she mean?",qti,files,multi-choice-text,id783efcbf-32bf-4443-a619-bb0407aba74b,qti-choice-interaction
582be22db3fcec47978ddd67.json,582be22db3fcec47978ddd67,False,Kanasu's uncle recognises Zo as,qti,multi-language,files,multi-language-multiple-choice,id85dbd933-ad57-47b3-b8b2-9db9cd54c230,a new boy who has come to town.,idfb19ca09-40f3-4503-8fd3-e51391d30071,the boy Kanasu has spoken about.,idc208022a-a1ec-4fe8-9a75-f3c165703806,the student from Badapur who is in Kanasu's class.,id40a59d24-95ec-4c01-88b5-f97b4e168358,a customer who has come to buy vegetables.,qti-choice-interaction,ee_u1l07a04q01
582071e2b3fcec7d0b8b74cf.json,582071e2b3fcec7d0b8b74cf,False,I can express my likes and dislikes politely.,qti,multi-language,multi-language-multiple-choice,id7e7d933f-8ffd-4ba0-af31-7955bc64f611,Very Easily,id5540e941-5b26-4bde-ad30-4e6c4eee2ce6,Easily,idbdce6e96-9f7c-4121-ab25-31d557480084,With Some Difficulty,idd23caec2-490e-40fb-91e9-54dc3402d814,With Great Difficulty,qti-choice-interaction-survey,ee_u01l09a06q02
57fd0a3bb3fcec0b1b2a4c50.json,57fd0a3bb3fcec0b1b2a4c50,True,,qti,multi-language,multi-choice-randomized,files,multi-language-ordered-choice,id674155af-3eaa-42f9-ab62-7199a5638aaf,Some  ,id091413c7-2a6f-49d0-a4b8-0f0997dc2981,cycles,id28e9efae-2084-4acb-aa80-afb45b631a75,are,id15f8482b-bb82-4743-9a3c-9aa53c8abade,parked,id13ef9a49-8b32-4195-990e-dfaa01d40dd3,in,idfa8fce6d-c538-45ff-bae3-64007d6a7e9f,the,idaa0f6633-0cd0-49e6-8170-227fe7eed2e3,middle,idbdbeecd0-b7f6-4e25-92be-c133b105d529,of,idedc8c256-b4e5-46aa-80c9-f1f313e986f9,the market.,qti-order-interaction-mw-sentence,ee_u1l05a02q06
57fd2b26b3fcec0b1b2a4cb2.json,57fd2b26b3fcec0b1b2a4cb2,False,"When the story begins, what do the friends talk about? ",qti,multi-language,files,multi-language-multiple-choice,id01e838ec-65b1-4a1d-b99a-b88b56eb71d1,"Kanasu, Zo and Sahir are trying to decide what to play next. ",id33f78d0a-b524-405e-ae07-eefe09879908,"Kanasu, Zo and Sahir are trying to decide how many more rounds of the ground to take.  ",ide7ed37b9-f523-433c-9a22-17b07b8368ae,"Kanasu, Zo and Sahir are trying to decide when to meet next. ",id2245317b-d60b-41e3-a22c-18ae3341fc9e,"Kanasu, Zo and Sahir are trying to decide what to do next. ",qti-choice-interaction,ee_u1l05a04q01
57f53ab4b3fcec3154d6b9ce.json,57f53ab4b3fcec3154d6b9ce,False,Zo is carrying ----------- bags with him.,qti,multi-language,files,multi-language-multiple-choice,id4ee9609f-97f0-4896-af12-d6fbdc3d9664,one,id8a2268df-70ad-4746-bd21-5be9f2acc9a5,zero,idb369d5ca-a5b0-427d-a406-1921f7fa8d71,two,idfae9f772-2fa9-4d57-8a8a-7d107a3ceed9,three,qti-choice-interaction,ee_u1l01a03q03
57f54149b3fcec3154d6bb08.json,57f54149b3fcec3154d6bb08,False,I can use simple questions to get to know others,qti,multi-language,multi-language-multiple-choice,idf8eef5df-92cc-4db5-a292-c0b66a93ef5c,Easily,id12c887f0-8267-497c-87f0-05056c11579e,Very easily,id2c135326-fdac-497d-8ed2-476ce5fa9b79,With great difficulty,id9e37fa1e-ca10-47bc-a84a-0208083fd1cd,With difficulty,qti-choice-interaction-survey,ee_u1l01a05q04
