57ffe761b3fcec148d8e494b.json,57ffe761b3fcec148d8e494b,False,Samira thinks ________ taste better than grass. ,qti,multi-language,files,multi-language-multiple-choice,idb64afc39-9531-4b66-b354-5f4f78343a48,Idlis,id643196d1-ae16-4cb2-987b-4f2275ad53bc,Noodles,id1dfc7917-1286-4e3e-b67e-acca4b33e52e,Upma,id188cfc7d-ccee-4ea4-8348-76636ee446cc,Curry,qti-choice-interaction,eb_u01l07a08q03
57ecfa9ab3fcec0ee764793a.json,57ecfa9ab3fcec0ee764793a,False,“A parallelogram with one pair of adjacent sides equal is a rhombus”.The above statement is,qti,multi-language,multi-language-multiple-choice,id8970777b-b6f0-42c4-ba07-8af659d3c2c8,A) ALWAYS true.,id88c8247f-351c-49a1-8a14-112a9c6cef96,B) SOMETIMES true. ,id621337cc-34dc-4738-9acd-eef7d2dbab35,C) NEVER true.,qti-choice-interaction,m1_u0l00a00q10
57ee0b07b3fcec154609ebb5.json,57ee0b07b3fcec154609ebb5,False,“A parallelogram with one pair of adjacent sides equal is a rhombus”.The above statement is,qti,multi-language,multi-language-multiple-choice,id8970777b-b6f0-42c4-ba07-8af659d3c2c8,A) ALWAYS true.,id88c8247f-351c-49a1-8a14-112a9c6cef96,B) SOMETIMES true. ,id621337cc-34dc-4738-9acd-eef7d2dbab35,C) NEVER true.,qti-choice-interaction-survey,m1_u0l01a00q10
57ee4bdcb3fcec154609ef81.json,57ee4bdcb3fcec154609ef81,False,I can answer simple questions based on the story.,qti,multi-language,multi-language-multiple-choice,id6e29e359-e223-46b7-a33b-1c5d661708c8,Very easily ,idf4cb55f2-4e70-4c68-b8bb-f0e46a531967,Easily ,idb97fbf7f-81e9-4212-a674-fa6b4dc64cdf,With difficulty,idf1914489-1ffe-4fe0-afe8-352880a79931,With great difficulty. ,qti-choice-interaction-survey,eb_u01l09a08q04
57fbd417b3fcec7e0a2026a0.json,57fbd417b3fcec7e0a2026a0,False,"Sahir's mother asks Kanasu, Sahir and Zo to keep quiet because- ",qti,multi-language,files,multi-language-multiple-choice,id4d7cdbd2-7206-4acb-af08-ff090cf79aa3,"Kanasu, Zo and Sahir were studying. ",id10ff4b46-f6f2-4401-b6bc-fb8f5e8ff70e,"Kanasu, Zo and Sahir had a holiday. ",id6e9095fe-fa57-4391-9623-09b6b1dd1ca3,Sahir's grandmother was sleeping. ,idbeeaa468-903b-439a-b02b-5c5503041b84,Sahir's grandmother was listening to the radio. ,qti-choice-interaction,ee_u1l04a04q02
57f49d9db3fcec3154d6b10f.json,57f49d9db3fcec3154d6b10f,True,I can ask questions and answer them.,qti,multi-language,multi-choice-randomized,multi-language-multiple-choice,id6d6da2a6-c8e3-4eab-b650-f5fd5deae854,Very easily ,id189e2d23-f82b-42b0-b175-b3590fc4d32f,Easily ,id7c66c21f-1503-4a57-b274-e70c4e2d829e,With difficulty,id745902b3-cbe4-4983-9123-9a83fa23d562,With great difficulty. ,qti-choice-interaction-survey,eb_u01l10a09q02
57e8f0feb3fcec1309c4db02.json,57e8f0feb3fcec1309c4db02,True,,qti,file-submission,question choice response id null,qti-upload-interaction-audio
584409c2b3fcec051a40ea9b.json,584409c2b3fcec051a40ea9b,True,"""दो विषम संख्यायों को जोड़ने पर एक सम संख्या मिलता है""।बतायें यह उपरोक्त कथन सही है अथवा गलत। अपने उत्तर के कारण बतायें।",qti,multi-language,multi-language-text-interaction,question choice response id null,qti-extended-text-interaction,m1_u00l00a02q14
57f545dab3fcec3154d6bccc.json,57f545dab3fcec3154d6bccc,False,I can understand words and phrases used for introducing others. ,qti,multi-language,multi-language-multiple-choice,idc3e98905-0cc4-4baa-a0f0-6fcbe4ae5289,Very easily,id244eb058-6295-4d21-b561-d2a21d61fdae,Easily,id5eeaae84-f470-4b9c-9142-0252f7e2adb3,With difficulty,ide0b46778-0540-412e-ade8-bbeeb119210a,With great difficulty ,qti-choice-interaction-survey,ee_u1l02a06q02
57e8fde6b3fcec1309c4e3eb.json,57e8fde6b3fcec1309c4e3eb,True,,qti,file-submission,question choice response id null,qti-upload-interaction-generic
582acce2b3fcec47978dd9a1.json,582acce2b3fcec47978dd9a1,False,Kanasuhad toldZoabouteveryonein her familyandhad toldher unclea lot aboutZoShewasvery,qti,multi-language,multi-language-inline-choice,qti-inline-choice-interaction-mw-fill-in-the-blank,ee_u1l07a07q05
57ea2969b3fcec1309c4f062.json,57ea2969b3fcec1309c4f062,False,I can understand the gist of a story.,qti,multi-choice-text,id7122b7d4-ce2e-43d5-b511-50477493eb53,qti-choice-interaction-survey
5820d171b3fcec7d0b8b78ee.json,5820d171b3fcec7d0b8b78ee,True,We can share with others our opinions.,qti,multi-language,multi-choice-randomized,multi-language-multiple-choice,id474082a1-d8d0-44fb-bc85-e2e5a1ba22f0,Very easily,id27b6a28d-a6b1-4b23-832b-055ca08f901c,Easily,idbba43980-26a9-45f1-a4cc-e83f3d72ab7b,With some difficulty ,id5fe38e71-1a74-415c-b06e-8f73be5f2bf9,With great difficulty ,qti-choice-interaction-survey,ee_u1l07a08q05
57ea1fefb3fcec1309c4eb27.json,57ea1fefb3fcec1309c4eb27,False,I can make sentences.,qti,multi-choice-text,idb7d29d4d-97c7-4cd1-8b5e-8cea6d139de2,qti-choice-interaction-survey
57ee513ab3fcec154609f11a.json,57ee513ab3fcec154609f11a,True,,qti,multi-language,multi-language-file-submission,question choice response id null,qti-upload-interaction-audio,eb_u01l09a04q01
5823064eb3fcec0e07439e0a.json,5823064eb3fcec0e07439e0a,False,Danny did not help his father on the field because ________,qti,multi-language,files,multi-language-multiple-choice,files,id5f000b29-da0e-4d4f-bacd-2afddd1f86e9,he had decided to help only after the canal was constructed.,idc2225aa6-ad53-489b-bc56-615d1f99e551,he had decided to become a geologist.,id070817ac-f05e-4b47-b12d-28420a5c4382,he had decided to join the new youth group in the village.,ida53751d9-aa13-4113-97bb-976597e3f955,he had decided to finish his Class 12.,qti-choice-interaction,ee_u1l10a04q02
57ff7ffbb3fcec148d8e3e1b.json,57ff7ffbb3fcec148d8e3e1b,False,What is Tara's occupation?,qti,multi-language,files,multi-language-multiple-choice,idcd4c5c37-bf5d-4acb-8438-18400d90c896,She is a child photographer.,id5d372d19-c579-47b4-a78b-f8e0831a6cab,She is a science photographer.,id1d144856-82fb-4a14-8514-644777f61c53,She is a wildlife photographer.,id4e66f52d-10f5-45dc-bac6-860e613717d9,She is a commercial photographer.,qti-choice-interaction,eb_u01l10a04q01
5822e728b3fcec0e07439b26.json,5822e728b3fcec0e07439b26,True,[what]{noun} [uncle]{noun} [do.]{verb} [was]{verb} [about]{prep} [to know]{verb} [curious]{adjective} [Zo]{noun} [Kanasu's]{noun} [would]{verb} ,qti,multi-language,multi-choice-randomized,multi-language-ordered-choice,idd997f3c0-9b5d-4528-976b-7cb7e060f226,Zo,id8d4e8467-1c54-44aa-91b1-f4e7c5ff5b22,was,iddf1fbf39-9838-40b8-a7d0-410ba18b3ed6,curious,id8d820602-9dd6-41f5-ba9a-fcbeb1ff4948,to know,id4f70cb78-dced-4f44-8b23-d8b60ab02f6e,about,id121b5eb9-bf78-47c1-8880-a27c886d5e6f,what,id75504214-89df-443a-9505-25cda450fa53,Kanasu's,idfe37b68d-5e7e-4339-8b68-8070a5ba9a77,uncle,idab8e3a7a-c05a-4cf0-a5ac-3eb9d5e9a3eb,would,id0a25a2dd-a823-4269-9f47-02f9e5db3231,do.,qti-order-interaction-mw-sentence,ee_u1l07a05q06
5819a3ccb3fcec45a7c91601.json,5819a3ccb3fcec45a7c91601,False, ,qti,multi-language,multi-language-ordered-choice,idfb9f95d3-d40c-45c8-8d06-f84d64b8ef61,A,id262d59b6-249c-45a7-be43-d675110543fd,shopkeep,id6ed4e38e-dfcc-4c08-810f-ab3aa479f453,is,iddd122e64-de7f-472e-9984-22728865ddb6,also,id3a33cdd4-0323-4dcd-80d7-e761a703b92d,known,id138616a1-d214-4b97-9065-337ead3e986d,as,id8d798621-40f7-4970-9480-4b519102dbf2,a,id449e0213-aa38-4ed4-a35e-97a77436cd95,vendor.,qti-order-interaction-mw-sandbox,ee_u1l07a06q02
57fd2b3eb3fcec0b1b2a4d18.json,57fd2b3eb3fcec0b1b2a4d18,False,"In the story you just heard, Kanasu is heard giving Zo directions from -",qti,multi-language,multi-language-multiple-choice,files,id373eafd9-66cb-4abc-badd-a5da65360626,her house to the village market.,id48301417-de25-489d-b4d6-7913f09f72d7,the playground to the village market.,id176d10f5-7a53-44ea-9079-1c79dd6c592e,the school to the village market.,id4640f530-6c9d-4598-8fa1-107a31fb34dc,Zo's house to the village market.,qti-choice-interaction,ee_u1l05a04q03
57e902f5b3fcec1309c4e5ae.json
58256ca4b3fcec0e0743acb5.json,58256ca4b3fcec0e0743acb5,False,"Why does Zo say, ""That is so unfair!""?",qti,multi-language,files,multi-language-multiple-choice,id7bc8d46e-d649-46cc-bcd7-e52415d99df3,Generating electricity is not fair.,id8b2dcaf4-2b8b-45b3-a40d-eec536d3daff,Building dams is not fair.,id7c8b6f9f-0a17-4e3f-b6ab-26ef0f61b752,Taking away land from villagers is not fair.,id6f1ae211-00d4-4082-9a0e-382259f5dba4,Electricity supplied only to the cities is not fair.,qti-choice-interaction,ee_u1l08a04q05
57fd2b82b3fcec0b1b2a4e09.json,57fd2b82b3fcec0b1b2a4e09,False,Why does Zo think that following the path will be an adventure?,qti,multi-language,multi-language-multiple-choice,files,id9daded3c-7d39-4610-838b-cd6f5e535d85,They don't know where the path will lead them.,idf6e4e0d2-ffb5-4496-bc22-9b6d157c9862,They've never been on this path before.,idedd02abb-87ac-4108-970f-9b41993cf481,It was a new path.,id879a09b3-fd83-4580-8d6e-0af0ba335490,They have never seen anyone take the path before.,qti-choice-interaction,ee_u1l05a04q08
57f53acdb3fcec3154d6ba44.json,57f53acdb3fcec3154d6ba44,False,Who tells Zo that the bus has reached Chotapur? ,qti,multi-language,files,multi-language-multiple-choice,idea7e9a6b-856b-4428-a68e-552d5f69848e,Zo's father ,id07c9e641-c46c-4e7b-9e07-d311daa832df,The bus conductor,id57e2f76f-d44b-4d62-8501-e549ef57e080,Kanasu,id3478e191-451f-476b-a264-364eff0a09db,Zo's grandma,qti-choice-interaction,ee_u1l01a03q01
57e90ba8b3fcec1309c4e5ee.json,57e90ba8b3fcec1309c4e5ee,True,Germsarevery creaturesthatyoucannot see. ,qti,qti-inline-choice-text,qti-inline-choice-interaction-mw-fill-in-the-blank
5820cb64b3fcec7d0b8b7597.json,5820cb64b3fcec7d0b8b7597,False,Why is Kanasu's uncle unhappy about the construction of the canal in Chotapur? ,qti,multi-language,files,multi-language-multiple-choice,id359f9ace-f361-4ca0-9829-7686cc3d4f2d,The canal will increase his work.,id72d698a8-a665-41af-9da8-ef0909dd98a0,He may have to sell his land to the government.,id1a117986-9c33-44b1-b94d-d1b0c5bdc0ce,The canal will reduce his work.,idaae4a955-5e8e-419a-9ed9-e6109a76b240,The canal will be built on his land.,qti-choice-interaction,ee_u1l06a04q06
57ecfa79b3fcec0ee764788a.json,57ecfa79b3fcec0ee764788a,False,Name a property that ALL these shapes have.,qti,multi-language,files,multi-language-multiple-choice,id1307e717-d861-4e62-bf5d-cb48a80a3bf1,A) one pair of parallel sides,id72904db2-90b9-4c4b-860c-d53ed96f39a0,B) one pair of equal sides,id467f441d-7bf8-42ea-83aa-7630417cec5b,C) one right angle,idf49cab6d-d3fa-406a-acc7-840cbdb6e477,D) The shapes do not have any property in common.,qti-choice-interaction,m1_u0l00a00q03
58440954b3fcec051a40e924.json,58440954b3fcec051a40e924,False,इनमें से किन चित्र/चित्रोंकी रेखाओं समानांतर हैं?',qti,multi-language,files,multi-language-multiple-choice,idb0d0b772-d62a-4484-9735-4b73387e22c2,"केवल P, R और S",id8b78f6f3-791f-495d-b9a4-da3fe281087b,केवल P,id4bbf2631-7bfd-4717-9cc1-4cebfbc120fa,केवल P और S,ida6615aa9-edf6-4432-8dab-77c33c27f27f,केवल Q,qti-choice-interaction,m1_u00l00a02q02
57ee0adcb3fcec154609eaf7.json,57ee0adcb3fcec154609eaf7,False,Name a property that ALL these shapes have.,qti,multi-language,files,multi-language-multiple-choice,id1307e717-d861-4e62-bf5d-cb48a80a3bf1,A) one pair of parallel sides,id72904db2-90b9-4c4b-860c-d53ed96f39a0,B) one pair of equal sides,id467f441d-7bf8-42ea-83aa-7630417cec5b,C) one right angle,idf49cab6d-d3fa-406a-acc7-840cbdb6e477,D) The shapes do not have any property in common.,qti-choice-interaction-survey,m1_u0l01a00q03
57ee4bc4b3fcec154609ef2b.json,57ee4bc4b3fcec154609ef2b,False,I can understand information given in a story.,qti,multi-language,multi-language-multiple-choice,ida9361049-10d3-417a-97f5-1755660550b9,Very easily ,id3dfd3171-20fb-4c92-b4d1-579f6b0d2645,Easily ,id75ed0754-58b1-401d-9f9f-1a4cd19313fc,With difficulty,idcb3d3367-42c2-4d68-a8bf-207ae0253179,With great difficulty. ,qti-choice-interaction-survey,eb_u01l09a08q02
57f54da1b3fcec3154d6c1da.json,57f54da1b3fcec3154d6c1da,False,I can match text with image.,qti,multi-language,multi-language-multiple-choice,id6ac1405b-d9fa-4cfb-bd28-3a8e81b16730,Very Easily,id9fcc4f85-f318-417c-8995-539a5c4fe85b,Easily,id1c29d696-7a88-472d-b92a-84470067bffa,With Difficulty,ida2b7453d-8cb9-442e-811e-563f1f6e4f24,With Great Difficulty,qti-choice-interaction-survey,ee_u01l04a06q04
582be250b3fcec47978dddf9.json,582be250b3fcec47978dddf9,False,"Kanasu's uncle tells Zo ""Please, give my regards to your grandmother!"" Which of the following do NOT mean what he said? ",qti,multi-language,files,multi-language-multiple-choice,idc8cdb6b5-e7c0-48a0-a253-62fd6ae4b732,I send my best wishes to your grandmother.,id28bc8921-5073-4767-beb9-79bdc639e856,Say hello to your grandmother for me. ,id71c55665-f353-4548-a231-843202c35a98,Tell your grandmother I send my respects. ,idc76e6b4c-f31c-473d-9a1b-7660ed9b8d35,Give the message to your grandmother that I would like to see her soon. ,qti-choice-interaction,ee_u1l07a04q07
57eb9a4eb3fcec04647ef094.json,57eb9a4eb3fcec04647ef094,False,I can      events one after another.,qti,qti-inline-choice-text,qti-inline-choice-interaction-mw-fill-in-the-blank
58256c85b3fcec0e0743ac33.json,58256c85b3fcec0e0743ac33,False,"According to Zo's Grandma, one of the reasons for building dams is ____________",qti,multi-language,files,multi-language-multiple-choice,id981fcc2e-7e09-4dcf-a847-6be1e6d7d015,to develop villages.,idef695e9a-5e70-4140-8dd2-a0fce5139bd2,to generate electricity.,idc779efb8-921a-44a0-afff-d04ac5e1d6c5,to support farmers.,id523f0c76-9cc5-4691-8792-49c5470e2731,to electrify villages.,qti-choice-interaction,ee_u1l08a04q03
57f164adb3fcec3154d6af27.json,57f164adb3fcec3154d6af27,True,,qti,multi-language,multi-language-file-submission,question choice response id null,qti-upload-interaction-audio,eb_u1l06a07q02
57fbd49ab3fcec7e0a2027b9.json,57fbd49ab3fcec7e0a2027b9,False,What wakes up Sahir's grandmother?  ,qti,multi-language,files,multi-language-multiple-choice,id5be9a233-186c-4dee-bff3-712143bf61d6,The radio playing. ,id027658b2-c33d-4052-8193-b58370cd8cfa,"Sahir, Zo and Kanasu talking. ",id75231f5c-437f-4d76-8f59-1e80bcb6a496,"Sahir, Zo and Kanasu studying together. ",idb7da60b0-b5e5-4958-a42f-d82e121eb3d5,Sahir's mother scolding the children. ,qti-choice-interaction,ee_u1l04a04q07
57ee0b25b3fcec154609ec1c.json,57ee0b25b3fcec154609ec1c,True,"‘If you add two even numbers you will get an odd number.’Say if the above statement is true or false, and give reasons for your answer.",qti,multi-language,multi-language-text-interaction,question choice response id null,qti-extended-text-interaction,m1_u0l01a00q15
57f54aafb3fcec3154d6c0b5.json,57f54aafb3fcec3154d6c0b5,False,I can understand when others talk about their personal goals. ,qti,multi-language,multi-language-multiple-choice,id1c882f9f-60d1-42e4-a3c0-19c82c82501d,Very Easily,idab5b899e-03a1-445a-a30d-cd7f72149a8c,Easily,idc23e2761-94cb-4895-b4e5-3221784a1829,With difficulty ,id9f5ac058-3ba0-424c-bb45-ca3cba38def4,With great difficulty ,qti-choice-interaction-survey,ee_u1l03a07q03
57e526c5b3fcec5f10d00d5d.json
582071ebb3fcec7d0b8b74fc.json,582071ebb3fcec7d0b8b74fc,False,I can listen to someone even when I don't like what he/she is saying.,qti,multi-language,multi-language-multiple-choice,iddbf69c92-2e5c-4701-91de-9346794873cb,Very Easily,idf280b087-f62e-4c8d-a709-9eca71cfb1c5,Easily,idcc3ef294-aced-47ae-ab9e-48617fde1b5d,With Some Difficulty,id1adca48e-d1ab-4cc3-b5a9-c4208f0948f6,With Great Difficulty,qti-choice-interaction-survey,ee_u01l09a06q03
57ee0b1fb3fcec154609ec0b.json,57ee0b1fb3fcec154609ec0b,True,"‘If you add two odd numbers you will get an even number.’Say if the above statement is true or false, and give reasons for your answer.",qti,multi-language,multi-language-text-interaction,question choice response id null,qti-extended-text-interaction,m1_u0l01a00q14
582be28fb3fcec47978ddf1d.json,582be28fb3fcec47978ddf1d,False,Price of goods increases -,qti,multi-language,files,multi-language-multiple-choice,id9e03da01-b3de-4e27-93fd-6844514ba707,"Graph with Demand and Supply on X and Y axes,  POINT - Low Demand, Low Supply.  ",id5997413b-e318-4cc6-b2d0-818b78e21637,"Graph with Demand and Supply on X and Y axes, POINT - High Demand, Low Supply.",idd54ab890-dc71-4789-9bef-5447a54a0cf0,"Graph with Demand and Supply on X and Y axes,   POINT - High Demand, High Supply.  ",id2e54e6e3-ec8c-41bf-a240-8c667b1a4a40,"Graph with Demand and Supply on X and Y axes,   POINT - Low Demand, High Supply.",qti-choice-interaction,ee_u1l07a04q04
58440966b3fcec051a40e966.json,58440966b3fcec051a40e966,False,इनमें से कौन-से गुणधर्म सभी समानांतर चतुर्भुजों के पास मौजूद हैं?,qti,multi-language,multi-language-multiple-choice,idd38abdae-a112-40ae-b240-33ba714ab44c,सभी भुजाओं की लम्बाई बराबर है।,id2c8795da-a8ac-4e47-a3de-67e834bae356,समानांतर भुजाओं के दो समूह हैं।,id2c6d4beb-c561-4c30-b2c4-f430b3a3062e,विकर्ण एक-दूसरे को समकोण पर समद्विभाजित करते हैं।,ide5960a41-0744-4cf2-800c-563283e571c0,सारे कोण बराबर हैं।,qti-choice-interaction,m1_u00l00a02q04
582071f3b3fcec7d0b8b7529.json,582071f3b3fcec7d0b8b7529,False,I can disagree politely.,qti,multi-language,multi-language-multiple-choice,idea44f6a1-9c52-46ab-9273-dc6074256e68,Very Easily,id985a82c7-ef6c-452b-886b-9911bb1742ad,Easily,id53e92a7c-8de8-445b-8fcd-2283517b8c3c,With Some Difficulty,id096b1029-ae82-4181-8e9b-fdbdfd606523,With Great Difficulty,qti-choice-interaction-survey,ee_u01l09a06q04
57ea1fe4b3fcec1309c4eb09.json,57ea1fe4b3fcec1309c4eb09,False,I can understand what people like to do.,qti,multi-choice-text,id6e07e68f-5906-4a73-9ebe-89038d7522bd,qti-choice-interaction-survey
57f163fcb3fcec3154d6ae86.json,57f163fcb3fcec3154d6ae86,False,Sringeri Srinivasreturnedhomevery happy.,qti,multi-language,multi-language-inline-choice,qti-inline-choice-interaction-mw-fill-in-the-blank,eb_u1l06a03q02
58012b9bb3fcec148d8e4b76.json,58012b9bb3fcec148d8e4b76,True,"If a quadrilateral has one pair of opposite sides equal, and the other pair parallel, then it is a parallelogram. ","अगर किसी चतुर्भुज में आमने सामने की भुजाओं का एक जोड़ा समान है, तो वह चतुर्भुज, समानान्तर चतुर्भुज होगा।   ⃞ सही  ⃞ गलत ",qti,multi-language,multi-language-text-interaction,question choice response id null,qti-extended-text-interaction,m1_u05l15a05q07
57fbd47eb3fcec7e0a202780.json,57fbd47eb3fcec7e0a202780,False,"200,000 crores has been sanctioned for the canal building project in --- ",qti,multi-language,files,multi-language-multiple-choice,files,id12cb5673-9dac-4468-b97b-7da13fe21e7d,Telangana and Mizoram ,id02223632-0c3e-433c-b046-eb6e7f158dc1,Mizoram and Chhattisgarh ,id40247c29-742a-4f5f-8a97-5450e66a6eb8,Mizoram and Rajasthan ,idfd7d12f3-0e46-4924-a1d5-931da44494d6,Telangana and Rajasthan ,qti-choice-interaction,ee_u1l04a04q06
57f54dd6b3fcec3154d6c255.json,57f54dd6b3fcec3154d6c255,False,I can read aloud short informative texts. ,qti,multi-language,multi-language-multiple-choice,ida2bd08d2-cb75-43e4-93f4-16b9b549fdff,Very Easily,idf401981d-244a-4f80-8aec-b1e051a31767,Easily,idcc30e7c5-fe0f-4faf-b4f2-cb1b75234468,With Difficulty,id230a18bb-25b4-47f4-912a-0e2032d2d1a0,With Great Difficulty,qti-choice-interaction-survey,ee_u01l04a06q03
58242139b3fcec0e0743a3c9.json,58242139b3fcec0e0743a3c9,False,I can understand expression of decisions.,qti,multi-language,multi-language-multiple-choice,id25c8ae32-6e03-4474-b002-142662963b8e,Very Easily,id0b8e2230-f6d5-403c-9023-9c23a1829d40,Easily,id7cd8b112-74a7-4bcb-ac20-00dd23efa3b4,With Some Difficulty,ida25d7735-4077-4cbd-bd72-b7b34f36f2e2,With Great Difficulty,qti-choice-interaction-survey,ee_u1l10a06q01
5820d067b3fcec7d0b8b77ee.json,5820d067b3fcec7d0b8b77ee,False,I can relate activities to specific times of the day.,qti,multi-language,multi-language-multiple-choice,idd40407ba-9dc9-47c6-8656-71edd7dce6c9,Very easily,id59d9776f-dbf2-461b-a971-1aef7aa85e28,Easily,id2b038b03-8086-4269-96ad-0da8fa4505f7,With some difficulty,idb659d1b6-f047-472f-b080-a5ce3b631b37,With great difficulty,qti-choice-interaction-survey,ee_u1l06a06q04
57e62df3b3fcec5f10d00da1.json,57e62df3b3fcec5f10d00da1,False,I can understand how to do things step-wise.,qti,multi-choice-text,id26fc829f-ce05-47e3-a684-d7bfaf766116,qti-choice-interaction-survey
57e8c429b3fcec1309c4da7c.json,57e8c429b3fcec1309c4da7c,False,Idon'twanttomyteeth.,qti,qti-inline-choice-text,qti-inline-choice-interaction-mw-fill-in-the-blank
57ff8008b3fcec148d8e3e4e.json,57ff8008b3fcec148d8e3e4e,False,What did the passenger in the train think Tara was doing? ,qti,multi-language,files,multi-language-multiple-choice,idb1dc32d4-f058-4815-9999-c81bcecbd291,Going home,id3a1311b0-e7b0-4fbd-a02b-5d956045e9dd,Travelling alone,id8d2e2be1-56ff-43a2-a1a6-2217f693f28d,Running away from home,id18424096-b765-480d-badb-404dfe34e277,Losing her way,qti-choice-interaction,eb_u01l10a04q02
5822e733b3fcec0e07439b63.json,5822e733b3fcec0e07439b63,True, ,qti,multi-language,multi-choice-randomized,multi-language-ordered-choice,iddfe7788f-b11e-4b6d-b89a-685f2d04b2cc,Kanasu's uncle,id5da53954-0b6f-401a-85ef-184d25ca4dfa,might,id84aeceaa-5acf-4427-829d-9a292d576978,have,idb29632df-c6a0-4526-93f4-3c403667ad34,to sell,id4fa1b5b9-5af5-46ac-b0dd-41688339de97,his,id0257b06a-d749-404d-b2a4-b35818e83d4f,land,id2449706e-e5de-4366-b448-1185d4c6759a,to,id4e7d72c1-81e0-4a46-b6d6-b4f50538f163,the,ida3d34230-44bc-4f51-aa36-68361558ba2e,government.,qti-order-interaction-mw-sentence,ee_u1l07a05q03
57ea2448b3fcec1309c4ece8.json,57ea2448b3fcec1309c4ece8,False,I can understand what the characters feel about something. ,qti,multi-choice-text,idea829bcd-ff18-41ab-8778-238a70855d89,qti-choice-interaction-survey
58230643b3fcec0e07439dcb.json,58230643b3fcec0e07439dcb,False,"Based on the story you have just heard, which of the following statements is true?",qti,multi-language,files,multi-language-multiple-choice,id8062bb9c-b32e-4f6c-bf9c-83e3ede67805,Danny and Sahir are not sure what to do next.,ide70b61ae-bdbc-4be9-bb83-1c03c0114796,Danny and Sahir want to go away from the village.,id1dd35d09-530f-4edf-a2e8-f7b7fe9aae64,Danny and Sahir have already made plans for their future.,id19b2474a-2a08-4774-9266-73654b79412b,Danny and Sahir take their father's advice.,qti-choice-interaction,ee_u1l10a04q09
57ee0af6b3fcec154609eb68.json,57ee0af6b3fcec154609eb68,False,"Name one property that ALL rectangles have, but some parallelograms need NOT have. ",qti,multi-language,multi-language-multiple-choice,idaba29fc3-cb1f-4778-907b-d235fe4561e3,A) Exactly two pairs of parallel sides,id2e604627-3233-409b-9216-22aa08316e2a,B) Exactly one pair of parallel sides,idce06dd6d-9f90-461f-963d-7c6bb4e197ef,C) All angles are right angle,iddb141965-76b8-452f-a01e-b81cb1eaa107,D) Opposite sides are equal,qti-choice-interaction-survey,m1_u0l01a00q07
57f548dab3fcec3154d6bf6a.json,57f548dab3fcec3154d6bf6a,True,Are there any more steps you would like to add to this list? Discuss these with your partner and write them down.Type your goals here:,qti,multi-language,multi-language-text-interaction,question choice response id null,qti-extended-text-interaction,ee_u1l03a06q04
5822e757b3fcec0e07439c57.json,5822e757b3fcec0e07439c57,True, ,qti,multi-language,multi-choice-randomized,multi-language-ordered-choice,id9e9fac8f-bb8c-4de2-8ba7-df7b3ed8e3c7,Kanasu's,idc1c7606e-78a7-421e-ac77-4d979eafa270,uncle,idcaa2e960-93fb-409e-8f28-251871e86ab8,felt,id233dd903-8330-490b-a1ee-1e3aa342f0f2,bad,id0922b323-2f87-45fd-95ce-f93ca9af6d72,that,iddbc405fd-ae74-4b7d-b7e7-80d4e9e39e98,he,idabbab009-f390-4fc6-9de9-6651fa37e407,might,id65f084ed-01f4-4303-945b-c2651ab2f857,have,idd9be8abb-e409-48f8-984f-a0e2eb583108,to buy,idfbd07a78-30d6-49f4-a432-01a0cb299de3,land,idc0930751-73e6-46b9-a372-f345720e35aa,far,id1d3e4c8b-71fb-4469-8dbf-3b1f8d0333ef,away.,qti-order-interaction-mw-sentence,ee_u1l07a05q05
5825720fb3fcec0e0743ae99.json,5825720fb3fcec0e0743ae99,False,"Fatima says: But, Danny doesn’t lift a finger. This means that Danny is - ",qti,multi-language,files,multi-language-multiple-choice,idc78d761e-cbc0-47b8-abd5-d313c4ad8c18,lazy and won't help at all.,id691f6eb4-500c-4582-849b-ddb6aeaf433c,not able to move his finger.,id0bc186f6-212a-447d-9c9e-700d65e71aad,able to lift his hand but not his finger.,idc9f9b229-16eb-4301-a89d-9c810044f4a6,unwell and cannot move.,qti-choice-interaction,ee_u01l09a04q03
57ed0630b3fcec0ee7647c17.json,57ed0630b3fcec0ee7647c17,False,I can answer questions about others,qti,multi-language,multi-language-multiple-choice,id16b42a14-d430-4f9b-a8a4-d181f4956014,Very easily,idd8372933-cd92-47c4-8f20-c54172c44cbf,Easily ,idd74d35f8-fdd0-472f-bd56-350cbb14601b,With difficulty ,idf657885f-df1d-492f-9037-d1896d92713a,With great difficulty ,qti-choice-interaction-survey,eb_u01l08a09q03
582071d9b3fcec7d0b8b74a2.json,582071d9b3fcec7d0b8b74a2,False,I can state my preferences.,qti,multi-language,multi-language-multiple-choice,idce9806ed-1c34-4e0e-8090-cfff41ff7c68,Very Easily,idad58fd1b-a8c4-4e21-934c-b1f23be964e1,Easily,idf7618771-50d2-4fa7-b17a-f12ecb2ff00c,With Some Difficulty,id49e6fa1f-8b94-4135-a0c8-6285d2f4d533,With Great Difficulty,qti-choice-interaction-survey,ee_u01l09a06q01
